AuthorID,Author,Date,Content,Attachments,Reactions
"1177977545099059283","fragolamoon_","2026-01-23T18:33:30.3900000+00:00","Please its a peak gamemode and its REALLY fun, i know its a creative server but many people want to play tag!!!","","star (2)"
"1248580991878955009","_theinfamousghost_","2026-03-15T23:13:21.6510000+00:00","Sure","",""
"705384820578189383","laurits123_","2026-03-21T15:04:24.4820000+00:00","bump","",""
"1248580991878955009","_theinfamousghost_","2026-03-21T16:12:35.1660000+00:00","atleast get us vr support bro","",""
"570127652334075925","andezp","2026-03-22T05:39:13.0650000+00:00","Best idea ever even though i don't think I'm going to be playing any time soon","","✅ (1)"
